{
	"$schema": "https://json-schema.org/draft/2020-12/schema",
	"title": "Stars Atlas App Config",
	"description": "Application, README, site, and classification settings for the generated stars atlas.",
	"type": "object",
	"additionalProperties": false,
	"properties": {
		"$schema": {
			"type": "string",
			"const": "./config.schema.json",
			"description": "Relative path to this schema file so editors can validate config/config.json.",
			"examples": ["./config.schema.json"]
		},
		"github": {
			"$ref": "#/$defs/githubConfig",
			"description": "GitHub account settings used to fetch starred repositories and derive profile metadata."
		},
		"classification": {
			"$ref": "#/$defs/classificationConfig",
			"description": "Controls how Jev classifies repositories: model, parallelism, taxonomy pruning, and the README-assisted second pass.",
			"default": {
				"model": "typesafe/jev-1.13",
				"baseUrl": "https://openrouter.ai/api/alpha/decisions",
				"enableReadmeFallback": false,
				"readmeFallbackConfidenceThreshold": 0.4
			}
		},
		"readme": {
			"$ref": "#/$defs/readmeConfig",
			"description": "Content settings used when regenerating the repository README."
		},
		"site": {
			"$ref": "#/$defs/siteConfig",
			"description": "Frontend shell, SEO, and manifest settings for the generated static site."
		}
	},
	"required": ["$schema", "github"],
	"$defs": {
		"trimmedString": {
			"type": "string",
			"minLength": 1,
			"pattern": ".*\\S.*",
			"description": "Non-empty string that should contain at least one non-whitespace character."
		},
		"githubUsername": {
			"type": "string",
			"minLength": 1,
			"maxLength": 39,
			"pattern": "^(?!-)(?!.*--)[A-Za-z0-9-]+(?<!-)$",
			"description": "GitHub username or organization login used for starred repository lookup.",
			"examples": ["sametcn99", "vercel", "microsoft"]
		},
		"httpUrl": {
			"type": "string",
			"format": "uri",
			"pattern": "^https?://[^\\s]+$",
			"description": "Absolute HTTP or HTTPS URL.",
			"examples": [
				"https://github.com/sametcn99.png",
				"https://example.com/social-card.png"
			]
		},
		"confidenceThreshold": {
			"type": "number",
			"minimum": 0,
			"maximum": 1,
			"description": "Confidence cutoff below which README fallback categorization becomes eligible.",
			"default": 0.4,
			"examples": [0.4, 0.5, 0.6]
		},
		"githubConfig": {
			"title": "GitHub Config",
			"type": "object",
			"additionalProperties": false,
			"properties": {
				"username": {
					"$ref": "#/$defs/githubUsername"
				}
			},
			"required": ["username"]
		},
		"classificationConfig": {
			"title": "Classification Config",
			"type": "object",
			"additionalProperties": false,
			"properties": {
				"model": {
					"type": "string",
					"minLength": 1,
					"description": "Decision model id on the configured decisions endpoint.",
					"default": "typesafe/jev-1.13",
					"examples": ["typesafe/jev-1.13", "~typesafe/jev-latest"]
				},
				"baseUrl": {
					"type": "string",
					"format": "uri",
					"pattern": "^https?://[^\\s]+$",
					"description": "Jev decisions endpoint. OpenRouter serves the TypeSafe wire format here.",
					"default": "https://openrouter.ai/api/alpha/decisions"
				},
				"concurrency": {
					"type": "integer",
					"minimum": 1,
					"description": "How many Jev evaluations run in parallel.",
					"default": 12
				},
				"minCategorySize": {
					"type": "integer",
					"minimum": 1,
					"description": "Categories holding fewer repositories than this are pruned, and their repositories are re-asked against the surviving options.",
					"default": 5
				},
				"minTopicCount": {
					"type": "integer",
					"minimum": 1,
					"description": "How often a GitHub topic must appear before it becomes a candidate category.",
					"default": 8
				},
				"maxDerivedCategories": {
					"type": "integer",
					"minimum": 1,
					"description": "Upper bound on topic-derived categories added to the seed taxonomy.",
					"default": 25
				},
				"derivedCategoryMinScore": {
					"type": "number",
					"minimum": 0,
					"maximum": 3,
					"description": "Minimum position on Jev's topic-quality rubric (0 useless, 1 technology name, 2 narrow niche, 3 clear category) for a mined topic to become a category.",
					"default": 2
				},
				"enableReadmeFallback": {
					"type": "boolean",
					"description": "When true, repositories Jev was unsure about are re-evaluated with their README as extra evidence.",
					"default": false
				},
				"readmeFallbackConfidenceThreshold": {
					"$ref": "#/$defs/confidenceThreshold"
				},
				"readmeCharacterLimit": {
					"type": "integer",
					"minimum": 1,
					"description": "How much README text is sent to Jev during the fallback pass.",
					"default": 8000
				}
			}
		},
		"readmeConfig": {
			"title": "README Config",
			"type": "object",
			"additionalProperties": false,
			"properties": {
				"title": {
					"$ref": "#/$defs/trimmedString",
					"description": "Top-level title used in the generated README."
				},
				"description": {
					"$ref": "#/$defs/trimmedString",
					"description": "Short summary shown near the top of the generated README."
				}
			}
		},
		"siteSeoConfig": {
			"title": "Site SEO Config",
			"type": "object",
			"additionalProperties": false,
			"properties": {
				"description": {
					"$ref": "#/$defs/trimmedString",
					"description": "Default meta description for the generated site."
				},
				"ogDescription": {
					"$ref": "#/$defs/trimmedString",
					"description": "Open Graph description used for link previews."
				},
				"twitterDescription": {
					"$ref": "#/$defs/trimmedString",
					"description": "Twitter card description text."
				},
				"twitterCard": {
					"$ref": "#/$defs/trimmedString",
					"description": "Twitter card type, for example summary_large_image.",
					"examples": ["summary_large_image", "summary"]
				},
				"socialImageUrl": {
					"$ref": "#/$defs/httpUrl",
					"description": "Absolute URL for the social preview image."
				},
				"iconUrl": {
					"$ref": "#/$defs/httpUrl",
					"description": "Absolute URL for the manifest/app icon source."
				}
			}
		},
		"siteManifestConfig": {
			"title": "Site Manifest Overrides",
			"type": "object",
			"additionalProperties": false,
			"properties": {
				"shortName": {
					"$ref": "#/$defs/trimmedString",
					"description": "Short application name used in the web manifest."
				},
				"description": {
					"$ref": "#/$defs/trimmedString",
					"description": "Manifest description shown by install surfaces."
				}
			}
		},
		"siteConfig": {
			"title": "Site Config",
			"type": "object",
			"additionalProperties": false,
			"properties": {
				"title": {
					"$ref": "#/$defs/trimmedString",
					"description": "Base site title used in the browser title and generated metadata."
				},
				"url": {
					"$ref": "#/$defs/httpUrl",
					"description": "Canonical public URL of the deployed site, without a trailing slash."
				},
				"heroTitle": {
					"$ref": "#/$defs/trimmedString",
					"description": "Headline text used in the site hero section."
				},
				"heroDescription": {
					"$ref": "#/$defs/trimmedString",
					"description": "Supporting hero copy shown on the landing section."
				},
				"profileLinkLabel": {
					"$ref": "#/$defs/trimmedString",
					"description": "Label for the GitHub profile link shown in the site shell."
				},
				"seo": {
					"$ref": "#/$defs/siteSeoConfig"
				},
				"manifest": {
					"$ref": "#/$defs/siteManifestConfig"
				}
			}
		}
	}
}
